{
  "$schema": "../../../../schemas/place.schema.json",
  "country_code": "jp",
  "region_slug": "nagano",
  "place_slug": "hakuba-cortina",
  "name": "Hakuba Cortina",
  "region": "Nagano",
  "country": "Japan",
  "coordinates": {
    "latitude": 36.778729,
    "longitude": 137.881863
  },
  "elevations": {
    "base_m": 823,
    "summit_m": 1426
  },
  "tags": [
    "nagano",
    "hakuba-valley",
    "resort",
    "powder"
  ],
  "name_i18n": {
    "ko": "하쿠바 코르티나",
    "en": "Hakuba Cortina",
    "ja": "白馬コルチナスキー場"
  },
  "region_i18n": {
    "ko": "나가노",
    "en": "Nagano",
    "ja": "長野"
  },
  "country_i18n": {
    "ko": "일본",
    "en": "Japan",
    "ja": "日本"
  },
  "provenance": {
    "source": "osm",
    "osm_way_id": 773558919,
    "osm_version": 7,
    "contributor": "powder-nomad",
    "last_verified": "2026-08-18"
  }
}
