{
  "$schema": "../../../../schemas/place.schema.json",
  "country_code": "jp",
  "region_slug": "niigata",
  "place_slug": "akakura-onsen",
  "name": "Akakura Onsen",
  "region": "Niigata",
  "country": "Japan",
  "coordinates": {
    "latitude": 36.896406,
    "longitude": 138.169182
  },
  "elevations": {
    "base_m": 686,
    "summit_m": 1156
  },
  "tags": [
    "niigata",
    "myoko",
    "resort"
  ],
  "name_i18n": {
    "ko": "아카쿠라 온천",
    "en": "Akakura Onsen",
    "ja": "赤倉温泉スキー場"
  },
  "region_i18n": {
    "ko": "니가타",
    "en": "Niigata",
    "ja": "新潟"
  },
  "country_i18n": {
    "ko": "일본",
    "en": "Japan",
    "ja": "日本"
  },
  "homepage": "https://akakura-ski.com/",
  "provenance": {
    "source": "osm",
    "osm_way_id": 937100227,
    "osm_version": 2,
    "contributor": "powder-nomad",
    "last_verified": "2026-08-18"
  }
}
