{
  "$schema": "../../../../schemas/place.schema.json",
  "country_code": "jp",
  "region_slug": "iwate",
  "place_slug": "hachimantai-panorama",
  "name": "Hachimantai Panorama",
  "region": "Iwate",
  "country": "Japan",
  "coordinates": {
    "latitude": 39.883874,
    "longitude": 140.977743
  },
  "elevations": {
    "base_m": 547,
    "summit_m": 971
  },
  "tags": [
    "iwate",
    "tohoku",
    "resort"
  ],
  "name_i18n": {
    "ko": "하치만타이 파노라마",
    "en": "Hachimantai Panorama",
    "ja": "八幡平リゾート パノラマスキー場"
  },
  "region_i18n": {
    "ko": "이와테",
    "en": "Iwate",
    "ja": "岩手"
  },
  "country_i18n": {
    "ko": "일본",
    "en": "Japan",
    "ja": "日本"
  },
  "provenance": {
    "source": "osm",
    "osm_way_id": 1201572807,
    "osm_version": 1,
    "contributor": "powder-nomad",
    "last_verified": "2026-10-01"
  }
}
