{
  "$schema": "../../../../schemas/place.schema.json",
  "country_code": "jp",
  "region_slug": "iwate",
  "place_slug": "hachimantai-shimokura",
  "name": "Hachimantai Shimokura",
  "region": "Iwate",
  "country": "Japan",
  "coordinates": {
    "latitude": 39.897082,
    "longitude": 140.944379
  },
  "elevations": {
    "base_m": 597,
    "summit_m": 1146
  },
  "tags": [
    "iwate",
    "tohoku",
    "resort"
  ],
  "name_i18n": {
    "ko": "하치만타이 시모쿠라",
    "en": "Hachimantai Shimokura",
    "ja": "八幡平リゾート 下倉スキー場"
  },
  "region_i18n": {
    "ko": "이와테",
    "en": "Iwate",
    "ja": "岩手"
  },
  "country_i18n": {
    "ko": "일본",
    "en": "Japan",
    "ja": "日本"
  },
  "provenance": {
    "source": "osm",
    "osm_way_id": 960915602,
    "osm_version": 3,
    "contributor": "powder-nomad",
    "last_verified": "2026-10-01"
  }
}
