{
  "$schema": "../../../../schemas/place.schema.json",
  "country_code": "jp",
  "region_slug": "nagano",
  "place_slug": "tangram",
  "name": "Tangram Madarao Ski Circus",
  "region": "Nagano",
  "country": "Japan",
  "coordinates": {
    "latitude": 36.850258,
    "longitude": 138.263942
  },
  "elevations": {
    "base_m": 792,
    "summit_m": 1296
  },
  "tags": [
    "nagano",
    "resort",
    "family"
  ],
  "name_i18n": {
    "ko": "탕그램",
    "en": "Tangram Madarao Ski Circus",
    "ja": "タングラムスキーサーカス"
  },
  "region_i18n": {
    "ko": "나가노",
    "en": "Nagano",
    "ja": "長野"
  },
  "country_i18n": {
    "ko": "일본",
    "en": "Japan",
    "ja": "日本"
  },
  "homepage": "https://www.tangram.jp/ski/",
  "provenance": {
    "source": "osm",
    "osm_way_id": 997044731,
    "osm_version": 4,
    "contributor": "powder-nomad",
    "last_verified": "2026-08-18"
  }
}
