{
  "$schema": "../../../../schemas/place.schema.json",
  "country_code": "jp",
  "region_slug": "niigata",
  "place_slug": "seki-onsen",
  "name": "Seki Onsen",
  "region": "Niigata",
  "country": "Japan",
  "coordinates": {
    "latitude": 36.905787,
    "longitude": 138.157214
  },
  "elevations": {
    "base_m": 855,
    "summit_m": 1219
  },
  "tags": [
    "niigata",
    "myoko",
    "resort",
    "local-favorite"
  ],
  "name_i18n": {
    "ko": "세키 온천",
    "en": "Seki Onsen",
    "ja": "関温泉スキー場"
  },
  "region_i18n": {
    "ko": "니가타",
    "en": "Niigata",
    "ja": "新潟"
  },
  "country_i18n": {
    "ko": "일본",
    "en": "Japan",
    "ja": "日本"
  },
  "homepage": "http://sekionsen.jp/",
  "provenance": {
    "source": "osm",
    "osm_way_id": 937100228,
    "osm_version": 3,
    "contributor": "powder-nomad",
    "last_verified": "2026-08-18"
  }
}
