{
  "$schema": "../../../../schemas/place.schema.json",
  "country_code": "jp",
  "region_slug": "niigata",
  "place_slug": "ikenotaira-onsen",
  "name": "Ikenotaira Onsen Alpen Blick",
  "region": "Niigata",
  "country": "Japan",
  "coordinates": {
    "latitude": 36.873552,
    "longitude": 138.155528
  },
  "elevations": {
    "base_m": 763,
    "summit_m": 1500
  },
  "tags": [
    "niigata",
    "myoko",
    "resort"
  ],
  "name_i18n": {
    "ko": "이케노타이라",
    "en": "Ikenotaira Onsen Alpen Blick",
    "ja": "池の平温泉アルペンブリックスキー場"
  },
  "region_i18n": {
    "ko": "니가타",
    "en": "Niigata",
    "ja": "新潟"
  },
  "country_i18n": {
    "ko": "일본",
    "en": "Japan",
    "ja": "日本"
  },
  "homepage": "https://alpenblick-resort.com/ski",
  "provenance": {
    "source": "osm",
    "osm_way_id": 937086873,
    "osm_version": 5,
    "contributor": "powder-nomad",
    "last_verified": "2026-08-18"
  }
}
