{
  "$schema": "../../../../schemas/place.schema.json",
  "country_code": "jp",
  "region_slug": "nagano",
  "place_slug": "shiga-kogen",
  "name": "Shiga Kogen",
  "region": "Nagano",
  "country": "Japan",
  "coordinates": {
    "latitude": 36.721966,
    "longitude": 138.509045
  },
  "elevations": {
    "base_m": 1323,
    "summit_m": 2303
  },
  "tags": [
    "nagano",
    "resort",
    "destination"
  ],
  "name_i18n": {
    "ko": "시가 고원",
    "en": "Shiga Kogen",
    "ja": "志賀高原"
  },
  "region_i18n": {
    "ko": "나가노",
    "en": "Nagano",
    "ja": "長野"
  },
  "country_i18n": {
    "ko": "일본",
    "en": "Japan",
    "ja": "日本"
  },
  "provenance": {
    "source": "osm",
    "contributor": "powder-nomad",
    "last_verified": "2026-08-18"
  }
}
