{
  "$schema": "../../../../schemas/place.schema.json",
  "country_code": "jp",
  "region_slug": "nagano",
  "place_slug": "nozawa-onsen",
  "name": "Nozawa Onsen",
  "region": "Nagano",
  "country": "Japan",
  "coordinates": {
    "latitude": 36.917071,
    "longitude": 138.469038
  },
  "elevations": {
    "base_m": 551,
    "summit_m": 1637
  },
  "tags": [
    "nagano",
    "resort",
    "destination"
  ],
  "name_i18n": {
    "ko": "노자와 온천",
    "en": "Nozawa Onsen",
    "ja": "野沢温泉スキー場"
  },
  "region_i18n": {
    "ko": "나가노",
    "en": "Nagano",
    "ja": "長野"
  },
  "country_i18n": {
    "ko": "일본",
    "en": "Japan",
    "ja": "日本"
  },
  "homepage": "https://nozawaski.com/",
  "provenance": {
    "source": "osm",
    "osm_way_id": 938550591,
    "osm_version": 8,
    "contributor": "powder-nomad",
    "last_verified": "2026-08-18"
  }
}
