{
  "$schema": "../../../../schemas/place.schema.json",
  "country_code": "jp",
  "region_slug": "aomori",
  "place_slug": "aomori-spring",
  "name": "Aomori Spring Resort",
  "region": "Aomori",
  "country": "Japan",
  "coordinates": {
    "latitude": 40.682118,
    "longitude": 140.285797
  },
  "elevations": {
    "base_m": 372,
    "summit_m": 989
  },
  "tags": [
    "aomori",
    "tohoku",
    "resort"
  ],
  "name_i18n": {
    "ko": "아오모리 스프링",
    "en": "Aomori Spring Resort",
    "ja": "青森スプリング・スキーリゾート"
  },
  "region_i18n": {
    "ko": "아오모리",
    "en": "Aomori",
    "ja": "青森"
  },
  "country_i18n": {
    "ko": "일본",
    "en": "Japan",
    "ja": "日本"
  },
  "homepage": "https://aomorispringski.com",
  "provenance": {
    "source": "osm",
    "osm_way_id": 677033105,
    "osm_version": 6,
    "contributor": "powder-nomad",
    "last_verified": "2026-08-18"
  }
}
